{
  "id": "night_001",
  "platform": ["tiktok", "shorts", "reels", "telegram"],
  "duration": 8,
  "scene": "night_room",
  "hook": "ты опять не спишь?",
  "beats": [
    "и снова листаешь телефон",
    "как будто там появится ответ",
    "напиши Нити одну фразу",
    "она подхватит разговор"
  ],
  "ending": "@trynit_ai",
  "caption": "Он снова написал первым.",
  "hashtags": ["нить", "переписка", "ночь", "telegram"],
  "cta": "Попробовать в Telegram"
}
